{
  "$schema": "https://json-schema.org/draft/2020-12/schema",
  "$id": "https://ai-assembly-line.local/contracts/task_batch.schema.json",
  "title": "TaskBatch",
  "type": "object",
  "additionalProperties": false,
  "required": [
    "schema_version",
    "batch_id",
    "source_plan_path",
    "tasks"
  ],
  "properties": {
    "schema_version": {
      "type": "string",
      "minLength": 1
    },
    "batch_id": {
      "type": "string",
      "pattern": "^[a-z0-9][a-z0-9\\-]*$"
    },
    "source_plan_path": {
      "type": "string",
      "minLength": 1
    },
    "tasks": {
      "type": "array",
      "items": {
        "$ref": "./task.schema.json"
      }
    }
  }
}
