{
  "schema_version": "0.1.0",
  "batch_id": "verification-release",
  "source_plan_path": "assembly/generated/project_spec.json",
  "tasks": [
    {
      "id": "VER-001",
      "title": "Create independent shared-contract regression suites",
      "summary": "Verify domain, model-manifest, archive, and fake-adapter contracts independently from their implementing lane.",
      "objective": "Prevent parallel application and ML work from drifting away from accepted shared interfaces.",
      "context": "Contract fixtures are the first cross-lane dependency and require independent schema, compatibility, and behavior checks.",
      "owner_role": "Verification and Release",
      "lane": "independent-verification",
      "repo_target": "categorizer",
      "status": "ready",
      "priority": "P0",
      "milestone": "MVP acceptance",
      "allowed_areas": ["verification/**", "shared/**/test/**", "ml/tests/**", "docs/verification/**"],
      "depends_on": ["CONTRACT-001", "CONTRACT-002", "CONTRACT-003", "CONTRACT-004"],
      "inputs": ["Accepted shared contracts", "Positive and negative fixtures", "Compatibility/version policies"],
      "outputs": ["Independent contract test harness", "Manifest/class-map negative tests", "Archive compatibility/security fixture tests", "Contract conformance report"],
      "implementation_notes": ["Consume public interfaces and checked-in fixtures rather than implementation internals.", "Include failures for duplicate class IDs, hash mismatch, incompatible versions, traversal paths, corrupt archives, and unsupported recognition states."],
      "acceptance_criteria": ["Every shared contract has at least one positive and one negative independent test.", "Manifest, archive, and domain fixtures are validated without relying on producer self-tests.", "Compatibility and error outcomes match the accepted policy.", "The suite runs through documented repository commands."],
      "verification": ["Run the independent suite against current contracts.", "Intentionally corrupt representative fixtures and confirm failures are detected.", "Record covered invariants and any gaps."],
      "proof_required": ["Test output", "Contract coverage matrix", "Conformance report"],
      "edge_cases": ["Unknown future fields", "Class-map reorder", "Manual identity outside catalog", "Archive path traversal", "Hash mismatch"],
      "non_goals": ["Implementing production adapters", "Changing accepted contract semantics"],
      "estimated_size": "M",
      "risk_tags": ["contract-drift", "compatibility", "security"]
    },
    {
      "id": "VER-002",
      "title": "Verify Android application flows and restart persistence",
      "summary": "Create independent Android instrumentation coverage for camera/gallery acquisition, ranked review, album behavior, edits, search/filter, transfer, and process restart.",
      "objective": "Demonstrate that the accepted user experience works on Android beyond isolated implementation tests.",
      "context": "The application batch spans platform adapters, shared state, local persistence, and six user-facing screens.",
      "owner_role": "Verification and Release",
      "lane": "independent-verification",
      "repo_target": "categorizer",
      "status": "ready",
      "priority": "P0",
      "milestone": "MVP acceptance",
      "allowed_areas": ["verification/**", "apps/androidApp/src/androidTest/**", "apps/androidApp/src/test/**", "shared/**/test/**", "docs/verification/**"],
      "depends_on": ["UI-001", "UI-002", "UI-003", "UI-004", "UI-005", "UI-006", "APP-002", "APP-003", "APP-004", "APP-005"],
      "inputs": ["Android application candidate", "Fake and real recognition configurations", "Media and archive fixtures"],
      "outputs": ["End-to-end instrumentation suite", "Process-death/restart persistence suite", "Accessibility and recoverable-error checklist", "Application verification report"],
      "implementation_notes": ["Use deterministic test data and fake inference for application-only paths, then repeat a critical path with the production adapter.", "Exercise system picker/camera/document boundaries using supported instrumentation techniques without weakening permissions."],
      "acceptance_criteria": ["Camera and gallery flows each reach explicit confirmation and create exactly one durable entry.", "Favorites, notes, identity edits, search/filter, and deletion persist correctly across restart.", "Export/import round-trips through the user flow and invalid archives never enable confirmation.", "Canceled, denied, malformed, low-storage, and missing-image states are recoverable and do not create orphan records."],
      "verification": ["Run the suite on an emulator and at least one supported physical device.", "Force-stop/relaunch or recreate process state at defined checkpoints.", "Inspect runtime permissions and private storage behavior."],
      "proof_required": ["Instrumentation logs", "Device/environment record", "Screenshots or recording of critical flows", "Application verification report"],
      "edge_cases": ["Process death during capture", "Duplicate confirm", "Entry deleted while visible", "Low storage", "Revoked picker access", "Corrupt import"],
      "non_goals": ["iOS/desktop testing", "Cloud or account testing", "Visual polish beyond accepted usability"],
      "estimated_size": "M",
      "risk_tags": ["android-lifecycle", "persistence", "end-to-end"]
    },
    {
      "id": "VER-003",
      "title": "Independently reproduce ML accuracy, equivalence, and device gates",
      "summary": "Re-run held-out/per-class evaluation, PyTorch/ONNX/Android ranking equivalence, and the accepted device latency/size/memory protocol for the release candidate.",
      "objective": "Ensure model acceptance is based on independently reproducible evidence rather than producer self-report.",
      "context": "The accepted model gates are at least 80% held-out top-five accuracy and median inference below two seconds on the selected device, within accepted budgets.",
      "owner_role": "Verification and Release",
      "lane": "android-benchmark",
      "repo_target": "categorizer",
      "status": "ready",
      "priority": "P0",
      "milestone": "MVP acceptance",
      "allowed_areas": ["verification/**", "ml/tests/**", "apps/androidApp/src/androidTest/**", "docs/verification/**"],
      "depends_on": ["DEC-001", "DEC-002", "DEC-003", "ML-004", "ML-005", "ML-006", "ML-007"],
      "inputs": ["Frozen held-out manifests", "Release-candidate bundle and model card", "Accepted benchmark device/protocol", "Accepted size/memory budgets"],
      "outputs": ["Independent aggregate and per-class evaluation report", "Cross-runtime equivalence report", "Cold/warm device latency report", "Package/model/installed/memory measurement report", "Gate decision"],
      "implementation_notes": ["Verify hashes of code, environment, splits, model, manifest, and class map before running.", "Do not tune or replace artifacts during independent verification; failures return to the owning task.", "Record thermal/power state and raw timing samples."],
      "acceptance_criteria": ["Independent held-out top-five accuracy is at least 80% and includes every supported class with sample counts.", "Python PyTorch, Python ONNX Runtime, and Android ONNX Runtime rankings satisfy the accepted equivalence policy.", "Median device inference is below two seconds under the accepted protocol.", "All accepted size and peak-memory budgets pass.", "The final gate decision references immutable artifact and input hashes."],
      "verification": ["Run all evaluation and equivalence commands from a clean environment.", "Run the full benchmark protocol on the named physical device.", "Cross-check package and installed-size measurements using independent tools."],
      "proof_required": ["Raw and summarized metrics", "Per-class report", "Equivalence report", "Device record and timing samples", "Artifact hashes and gate decision"],
      "edge_cases": ["Thermal throttling", "Class missing from held-out split", "Ranking ties", "ABI size differences", "First-run extraction", "Metric mismatch"],
      "non_goals": ["Lowering thresholds", "Selecting a different model during verification", "Marketing claims beyond the accepted test scope"],
      "estimated_size": "M",
      "risk_tags": ["independent-proof", "accuracy", "latency", "release-gate"]
    },
    {
      "id": "VER-004",
      "title": "Red-team photo privacy and archive integrity",
      "summary": "Challenge metadata removal, private storage, archive path handling, checksums, resource limits, conflicts, and atomic import behavior.",
      "objective": "Prove that local-only storage and manual transfer do not leak unnecessary metadata or corrupt the album under hostile inputs.",
      "context": "Privacy and archive safety are explicit merged boundaries, and invalid imports must cause no partial mutation.",
      "owner_role": "Verification and Release",
      "lane": "independent-verification",
      "repo_target": "categorizer",
      "status": "ready",
      "priority": "P0",
      "milestone": "MVP acceptance",
      "allowed_areas": ["verification/**", "apps/androidApp/src/androidTest/**", "apps/androidApp/src/test/**", "shared/**/test/**", "docs/verification/**"],
      "depends_on": ["APP-003", "APP-005", "UI-005", "CONTRACT-003"],
      "inputs": ["Managed-image pipeline", "Archive exporter/importer", "Positive and adversarial fixtures"],
      "outputs": ["Independent metadata/privacy inspection", "Archive fuzz/adversarial suite", "Atomicity failure-injection results", "Privacy and archive risk report"],